NCT Number,Study Title,Study URL,Study_Status,Study Type
NCT03689088,Sensing Contact Lens-based Device for 24-hour Monitoring of Intraocular Pressure,https://clinicaltrials.gov/study/NCT03689088,COMPLETED,INTERVENTIONAL
NCT03323138,Study on Ex-PRESS Implantation Combined With Phacoemulsification in Primary Angle-closure Glaucoma,https://clinicaltrials.gov/study/NCT03323138,UNKNOWN,INTERVENTIONAL
NCT01308788,Aqueous Suppressant Versus Aqueous Outflow on Ocular Blood Flow,https://clinicaltrials.gov/study/NCT01308788,COMPLETED,OBSERVATIONAL
NCT01906138,An Open Label Study Assessing the 24-hour Intraocular Pressure Pattern in PAC and PACG Patients Before and After Laser Peripheral Iridotomy,https://clinicaltrials.gov/study/NCT01906138,COMPLETED,INTERVENTIONAL
NCT04651231,Punch Trabeculectomy Versus Classic Trabeculectomy,https://clinicaltrials.gov/study/NCT04651231,COMPLETED,INTERVENTIONAL
NCT00346931,Phacotrabeculotomy Versus CCI+Phaco in Patients With Borderline Control of Intraocular Pressure,https://clinicaltrials.gov/study/NCT00346931,TERMINATED,INTERVENTIONAL
NCT01836042,Post-approval Study of The Glaukos® iStent® Trabecular Micro-bypass Stent: Extended Follow-up of the Premarket Cohort,https://clinicaltrials.gov/study/NCT01836042,COMPLETED,OBSERVATIONAL
NCT00758342,Azopt (Brinzolamide 1.0%) Plus Travatan (Travoprost 0.004%) in Treating Patients With Chronic Angle-Closure Glaucoma (CACG),https://clinicaltrials.gov/study/NCT00758342,TERMINATED,INTERVENTIONAL
NCT06120842,Evaluation of the Bimatoprost Implant System Used in Combination With the SpyGlass Intraocular Lens Compared to Timolol Ophthalmic Solution,https://clinicaltrials.gov/study/NCT06120842,RECRUITING,INTERVENTIONAL
NCT03268031,Artificial Intelligence-assissted Glaucoma Evaluation,https://clinicaltrials.gov/study/NCT03268031,COMPLETED,OBSERVATIONAL
NCT00541242,Safety and Efficacy of Bimatoprost Compared With Latanoprost in Patients With Glaucoma or Ocular Hypertension,https://clinicaltrials.gov/study/NCT00541242,COMPLETED,INTERVENTIONAL
NCT00716742,Safety and Efficacy Study of Bimatoprost Latanoprost and Travoprost in Patients With Elevated Intraocular Pressure (IOP) and Open-angle Glaucoma (OAG),https://clinicaltrials.gov/study/NCT00716742,COMPLETED,OBSERVATIONAL
NCT03506542,Phacotrabeculectomy With Collagen Matrix Implant (Ologen®) Versus Mitomycin C,https://clinicaltrials.gov/study/NCT03506542,COMPLETED,INTERVENTIONAL
NCT02014142,A Phase 2 Single-Masked Randomized Study of Latanoprost PPDS in Ocular Hypertension or Open-Angle Glaucoma,https://clinicaltrials.gov/study/NCT02014142,COMPLETED,INTERVENTIONAL
NCT02524431,The Changes Within the Cells of the Drainage System of the Eye in Patients With Glaucoma,https://clinicaltrials.gov/study/NCT02524431,WITHDRAWN,INTERVENTIONAL
NCT00384631,Intravitreal Bevacizumab for Neovascular Glaucoma,https://clinicaltrials.gov/study/NCT00384631,COMPLETED,INTERVENTIONAL
NCT03109665,Glaucoma Within Northern Ireland Cohort for the Longitudinal Study of Ageing,https://clinicaltrials.gov/study/NCT03109665,COMPLETED,OBSERVATIONAL
NCT02108288,Pharmacokinetic Study of OPC-1085EL Ophthalmic Solution in Healthy Male Adult Volunteers,https://clinicaltrials.gov/study/NCT02108288,COMPLETED,INTERVENTIONAL
NCT03338088,Evaluation of Adherence to Clinical Treatment of Glaucoma,https://clinicaltrials.gov/study/NCT03338088,UNKNOWN,OBSERVATIONAL
NCT02862938,Study of NT-501 Encapsulated Cell Therapy for Glaucoma Neuroprotection and Vision Restoration,https://clinicaltrials.gov/study/NCT02862938,ACTIVE_NOT_RECRUITING,INTERVENTIONAL
NCT01628588,Lumigan® in Patients With Primary Open Angle Glaucoma (POAG) or Ocular Hypertension (OHT),https://clinicaltrials.gov/study/NCT01628588,COMPLETED,OBSERVATIONAL
NCT01410188,Safety/Efficacy Study: OPA-6566 Ophthalmic Solution in Subjects With Primary Open-Angle Glaucoma or Ocular Hypertension,https://clinicaltrials.gov/study/NCT01410188,COMPLETED,INTERVENTIONAL
NCT01704989,The Laser in Pseudoexfoliation (LIP) Study,https://clinicaltrials.gov/study/NCT01704989,UNKNOWN,INTERVENTIONAL
NCT02014389,Evaluation of Objective Perimetry Using Chromatic Multifocal Pupillometer,https://clinicaltrials.gov/study/NCT02014389,RECRUITING,OBSERVATIONAL
NCT00476138,Effect of Epigallocatechin-Gallate on Inner Retinal Function in Ocular Hypertension and Early Glaucoma,https://clinicaltrials.gov/study/NCT00476138,UNKNOWN,INTERVENTIONAL
NCT02162043,Development and Evaluation of a Self-administered/Assisted Visual Field Screening Tool for Glaucoma,https://clinicaltrials.gov/study/NCT02162043,COMPLETED,OBSERVATIONAL
NCT01426867,A Comfort Study of Brinzolamide 1% / Brimonidine 0.2% Fixed Combination Brinzolamide 1% and Brimonidine 0.2%,https://clinicaltrials.gov/study/NCT01426867,COMPLETED,INTERVENTIONAL
NCT02613143,Zonulo-hyaloido-vitrectomy for Malignant Glaucoma,https://clinicaltrials.gov/study/NCT02613143,UNKNOWN,OBSERVATIONAL
NCT04406467,Retrospective Review of Xen Gel Stent Implantation With Open vs. Closed Conjunctiva Approach,https://clinicaltrials.gov/study/NCT04406467,COMPLETED,OBSERVATIONAL
NCT00150267,A 5-Year Postmarketing Safety Study Of Xalcom In Patients With Open Angle Glaucoma Or Ocular Hypertension,https://clinicaltrials.gov/study/NCT00150267,COMPLETED,INTERVENTIONAL
NCT01216943,Safety and Efficacy of Triple Combination Therapy in Patients With Glaucoma or Ocular Hypertension,https://clinicaltrials.gov/study/NCT01216943,COMPLETED,INTERVENTIONAL
NCT05041543,Safety and Tolerability of NTX-101 in Korean Healthy Volunteers,https://clinicaltrials.gov/study/NCT05041543,COMPLETED,INTERVENTIONAL
NCT02143843,An Open-Label Extension Study to Evaluate the Safety of the ForSight VISION5 Product,https://clinicaltrials.gov/study/NCT02143843,COMPLETED,INTERVENTIONAL
NCT00300443,Safety and Efficacy Study of Bimatoprost in Patients With Glaucoma or Ocular Hypertension,https://clinicaltrials.gov/study/NCT00300443,COMPLETED,INTERVENTIONAL
NCT04648943,The Effect of Trabeculectomy & Ex-PRESS Glaucoma Drainage Implant on the Corneal Biomechanical Properties,https://clinicaltrials.gov/study/NCT04648943,COMPLETED,INTERVENTIONAL
NCT00707421,Usefulness of Topical Non-Steroidal Anti-Inflammatory Drugs or Steroids Before Trabeculectomy and Clinical Outcomes,https://clinicaltrials.gov/study/NCT00707421,COMPLETED,INTERVENTIONAL
NCT00287521,A Study of Glaucoma Therapy to Treat Open-Angle Glaucoma or Ocular Hypertension,https://clinicaltrials.gov/study/NCT00287521,COMPLETED,INTERVENTIONAL
NCT05156021,A Study on the Treatment Strategy of NVG Secondary to PDR,https://clinicaltrials.gov/study/NCT05156021,COMPLETED,INTERVENTIONAL
NCT00273221,Combined Phacotube vs Phacotrabeculectomy:A Randomized Controlled Trial,https://clinicaltrials.gov/study/NCT00273221,UNKNOWN,INTERVENTIONAL
NCT03715231,NIDEK Gonioscope GS-1 for Glaucoma,https://clinicaltrials.gov/study/NCT03715231,COMPLETED,INTERVENTIONAL
NCT00449631,Multidrug Resistance After Trabeculectomy With Mitomycin C,https://clinicaltrials.gov/study/NCT00449631,COMPLETED,OBSERVATIONAL
NCT01514721,Efficacy of Changing to DuoTrav® (Travoprost 0.004%/Timolol 0.5% BAK-Free Fixed Combination) From Prior Therapy,https://clinicaltrials.gov/study/NCT01514721,TERMINATED,INTERVENTIONAL
NCT05328921,Effects of Systemic Drugs on Intraocular Pressure,https://clinicaltrials.gov/study/NCT05328921,RECRUITING,OBSERVATIONAL
NCT01943721,A Study of the VISION5 Product in Patients With Glaucoma or Ocular Hypertension,https://clinicaltrials.gov/study/NCT01943721,COMPLETED,INTERVENTIONAL
NCT01769521,Relationship Between 24-hour IOP Pattern and the 24-hour Blood Pressure Pattern in Patients With POAG,https://clinicaltrials.gov/study/NCT01769521,COMPLETED,INTERVENTIONAL
NCT02558712,Technology-based Eye Care Services (TECS) Compare,https://clinicaltrials.gov/study/NCT02558712,COMPLETED,INTERVENTIONAL
NCT05906212,Anterior Lens Capsule as a Spacer in the Deep Sclerectomy _ Phacoemulsification,https://clinicaltrials.gov/study/NCT05906212,ACTIVE_NOT_RECRUITING,INTERVENTIONAL
NCT00472810,Ologen (OculusGen)-Glaucoma MMC Control in Pakistan,https://clinicaltrials.gov/study/NCT00472810,COMPLETED,INTERVENTIONAL
NCT00980473,Argon Laser Peripheral Iridoplasty for Primary Angle Closure Glaucoma,https://clinicaltrials.gov/study/NCT00980473,UNKNOWN,INTERVENTIONAL
NCT01136473,Mechanism of Aphakic and Pseudophakic Glaucoma in Pediatric Patients,https://clinicaltrials.gov/study/NCT01136473,COMPLETED,OBSERVATIONAL
NCT01887873,Safety of Hyaluronan Thiomer i.o. Implant During Combined Phacoemulsification - Non Penetrating Deep Sclerectomy,https://clinicaltrials.gov/study/NCT01887873,COMPLETED,INTERVENTIONAL
NCT02874846,Nocturnal/Diurnal Intraocular Pressure-Lowering Effect of Netarsudil Ophthalmic Solution,https://clinicaltrials.gov/study/NCT02874846,COMPLETED,INTERVENTIONAL
NCT00918346,Pharmacodynamics of Tafluprost 0.0015% Eye Drops: a Comparison Between the Preserved and Unpreserved Formulation,https://clinicaltrials.gov/study/NCT00918346,COMPLETED,INTERVENTIONAL
NCT01525173,A Safety and Efficacy Study of ALPHAGAN® P and LUMIGAN® in Subjects Previously Treated With Latanoprost for Glaucoma and Ocular Hypertension,https://clinicaltrials.gov/study/NCT01525173,COMPLETED,INTERVENTIONAL
NCT04334473,IOP and Ocular Biometrics Changes After Phacoemulsification in Glaucoma Patients and Controls,https://clinicaltrials.gov/study/NCT04334473,COMPLETED,INTERVENTIONAL
NCT02129673,A Phase 1/2 Multicenter Randomized Study to Evaluate the Safety and Efficacy of VS101 Subconjunctival Latanoprost Insert in Subjects With Open-Angle Glaucoma or Ocular Hypertension,https://clinicaltrials.gov/study/NCT02129673,COMPLETED,INTERVENTIONAL
NCT01481077,A Dose Evaluation Study of the Effect of Plug Placement on the Efficacy and Safety of the Latanoprost Punctal Plug Delivery System (L-PPDS) in Subjects With Ocular Hypertension or Open-Angle Glaucoma,https://clinicaltrials.gov/study/NCT01481077,COMPLETED,INTERVENTIONAL
NCT04632329,Negative Pressure Applied by the Equinox MPD for Severe Open Angle Glaucoma,https://clinicaltrials.gov/study/NCT04632329,COMPLETED,INTERVENTIONAL
NCT03958929,Impact of an Educational Video on Satisfaction After Glaucoma Surgery,https://clinicaltrials.gov/study/NCT03958929,SUSPENDED,INTERVENTIONAL
NCT03648229,African Glaucoma Laser Trial,https://clinicaltrials.gov/study/NCT03648229,WITHDRAWN,INTERVENTIONAL
NCT03648229,African Glaucoma Laser Trial,https://clinicaltrials.gov/study/NCT03648229,WITHDRAWN,INTERVENTIONAL
NCT02785029,Optical Coherence Tomography (OCT) Reference Data Collection Study (S-2015-1),https://clinicaltrials.gov/study/NCT02785029,TERMINATED,INTERVENTIONAL
NCT02614651,AUgmented REality for the Visually Impaired - Part 1,https://clinicaltrials.gov/study/NCT02614651,COMPLETED,INTERVENTIONAL
NCT02250612,SYL040012 Treatment for Open Angle Glaucoma,https://clinicaltrials.gov/study/NCT02250612,COMPLETED,INTERVENTIONAL
NCT02822612,The EASE Study - Human Factor and Usability Testing of a Binocular OCT System,https://clinicaltrials.gov/study/NCT02822612,COMPLETED,OBSERVATIONAL
NCT04590651,Cataract Surgery in Patients With Pseudoexfoliation and Pseudoexfoliation Glaucoma,https://clinicaltrials.gov/study/NCT04590651,ENROLLING_BY_INVITATION,INTERVENTIONAL
NCT02474238,Comparing Nd:YAG Laser and Sequential Double Frequency YAG-Nd:YAG Laser Iridotomy,https://clinicaltrials.gov/study/NCT02474238,COMPLETED,INTERVENTIONAL
NCT00698438,Comparison Of Trabeculectomy Versus The Ex-PRESS Miniature Glaucoma Device In The Same Patient: A Prospective Randomized Study,https://clinicaltrials.gov/study/NCT00698438,COMPLETED,INTERVENTIONAL
NCT00650338,Safety and Efficacy Study of DE-104 Ophthalmic Solution to Treat Open-angle Glaucoma or Ocular Hypertension,https://clinicaltrials.gov/study/NCT00650338,COMPLETED,INTERVENTIONAL
NCT06144138,Impact of Breathing Exercises and Meditation on Reducing Stress and Improving Quality of Life of Glaucoma Patients: An Electronic Pilot Feasibility Study,https://clinicaltrials.gov/study/NCT06144138,NOT_YET_RECRUITING,INTERVENTIONAL
NCT00485238,ALPI vs Medical Therapy Effects on Optic Nerve Structure & Function,https://clinicaltrials.gov/study/NCT00485238,UNKNOWN,INTERVENTIONAL
NCT02623738,A Study Assessing the Efficacy and Safety of DE-117 Ophthalmic Solution in Subjects With Primary Open Angle Glaucoma or Ocular Hypertension -AYAME Study-,https://clinicaltrials.gov/study/NCT02623738,COMPLETED,INTERVENTIONAL
NCT02757677,Evaluation of Blood Flow Characteristics in Glaucoma Using Optical Coherence Tomography Angiography (OCT-A).,https://clinicaltrials.gov/study/NCT02757677,TERMINATED,OBSERVATIONAL
NCT03466177,Multimodal Retinal Imaging in the Detection and Follow-up of Alzheimer's Disease,https://clinicaltrials.gov/study/NCT03466177,RECRUITING,OBSERVATIONAL
NCT05924477,Glaucoma Drainage Device and Endothelial Cell Loss Compare Trial,https://clinicaltrials.gov/study/NCT05924477,RECRUITING,INTERVENTIONAL
NCT05924477,Glaucoma Drainage Device and Endothelial Cell Loss Compare Trial,https://clinicaltrials.gov/study/NCT05924477,RECRUITING,INTERVENTIONAL
NCT05924477,Glaucoma Drainage Device and Endothelial Cell Loss Compare Trial,https://clinicaltrials.gov/study/NCT05924477,RECRUITING,INTERVENTIONAL
NCT03933631,Pilocarpine Use After Kahook Goniotomy,https://clinicaltrials.gov/study/NCT03933631,RECRUITING,INTERVENTIONAL
NCT03362931,Safety and Effectiveness of the XEN45 Glaucoma Treatment System in Patients With Angle Closure Glaucoma,https://clinicaltrials.gov/study/NCT03362931,COMPLETED,INTERVENTIONAL
NCT03921931,Retinal Photoreceptor Outer Segment Length Before and After Light Stimulation - a Pilot Study,https://clinicaltrials.gov/study/NCT03921931,RECRUITING,INTERVENTIONAL
NCT01247831,The Effect of Selective Laser Trabeculoplasty (SLT) on Ocular Rigidity,https://clinicaltrials.gov/study/NCT01247831,COMPLETED,INTERVENTIONAL
NCT01026831,Preservative-Free MK2452 (Tafluprost) for Open-Angle Glaucoma/Ocular Hypertension (MK2452-001)(COMPLETED),https://clinicaltrials.gov/study/NCT01026831,COMPLETED,INTERVENTIONAL
NCT02077231,Study of Vitamin A and Carbomer in Comforting the Ocular Surface Irritations of Glaucoma Patients,https://clinicaltrials.gov/study/NCT02077231,COMPLETED,INTERVENTIONAL
NCT01669031,Randomized Controlled Trial on Visual Field Training,https://clinicaltrials.gov/study/NCT01669031,UNKNOWN,INTERVENTIONAL
NCT05043831,Direct Selective Laser Trabeculoplasty in Ethnic Chinese Population The Zhuiguang Trial,https://clinicaltrials.gov/study/NCT05043831,WITHDRAWN,INTERVENTIONAL
NCT01540331,Efficacy And Safety of Pneumatic Trabeculoplasty,https://clinicaltrials.gov/study/NCT01540331,COMPLETED,INTERVENTIONAL
NCT05530031,UBM Guided Site and Extent of Trabeculotomy in Pediatric Glaucoma,https://clinicaltrials.gov/study/NCT05530031,NOT_YET_RECRUITING,INTERVENTIONAL
NCT04426331,Vouchers to Increase Uptake of Already Free Eye Care,https://clinicaltrials.gov/study/NCT04426331,COMPLETED,INTERVENTIONAL
NCT00175786,Magnetic Resonance Imaging of Patients With Normal Tension Glaucoma,https://clinicaltrials.gov/study/NCT00175786,COMPLETED,OBSERVATIONAL
NCT05273385,Efficacy of the Nanodropper Device on Intraocular Pressure in Patients With Glaucoma,https://clinicaltrials.gov/study/NCT05273385,RECRUITING,INTERVENTIONAL
NCT05273385,Efficacy of the Nanodropper Device on Intraocular Pressure in Patients With Glaucoma,https://clinicaltrials.gov/study/NCT05273385,RECRUITING,INTERVENTIONAL
NCT05035394,Swedish Microinvasive Glaucoma Surgery Study (SMIGS),https://clinicaltrials.gov/study/NCT05035394,RECRUITING,INTERVENTIONAL
NCT02151318,Culturing TM Cells From Primary Open-angle Glaucoma Patient Biopsies,https://clinicaltrials.gov/study/NCT02151318,UNKNOWN,OBSERVATIONAL
NCT05104294,Correlation Between Optical Coherence Tomography Angiography and Photopic Negative Response in Patients With Glaucoma,https://clinicaltrials.gov/study/NCT05104294,COMPLETED,OBSERVATIONAL
NCT01511094,Goniocurettage as First Choice of Surgical Treatment in Chronic Open-Angle Glaucoma: Outcomes and Complications,https://clinicaltrials.gov/study/NCT01511094,UNKNOWN,INTERVENTIONAL
NCT04234932,Short-term Effect of Rho-kinase Inhibitor on Retinal Circulation,https://clinicaltrials.gov/study/NCT04234932,UNKNOWN,INTERVENTIONAL
NCT01510132,Travacom Post Marketing Surveillance Study,https://clinicaltrials.gov/study/NCT01510132,WITHDRAWN,INTERVENTIONAL
NCT00000132,Early Manifest Glaucoma Trial (EMGT),https://clinicaltrials.gov/study/NCT00000132,UNKNOWN,INTERVENTIONAL
NCT04562402,Phaco-ECP vs Phaco Alone in Primary Angle Closure,https://clinicaltrials.gov/study/NCT04562402,UNKNOWN,INTERVENTIONAL
NCT01488032,Differences in Nerve Fiber Layer Between Patients With Normal- and High-Pressure-Glaucoma,https://clinicaltrials.gov/study/NCT01488032,COMPLETED,OBSERVATIONAL
NCT00773877,Comparison of Retinal Nerve Fiber Layer (RNFL) Thickness Measurements by Time-Domain and Spectral-Domain OCT In Glaucoma Patients,https://clinicaltrials.gov/study/NCT00773877,UNKNOWN,OBSERVATIONAL
NCT06061718,Travoprost Intraocular Implant in Conjunction With Cataract Surgery,https://clinicaltrials.gov/study/NCT06061718,RECRUITING,INTERVENTIONAL
NCT00152932,Ocular Blood Flow in Early Glaucoma Patients Before and After Treatment With Dorzolamide,https://clinicaltrials.gov/study/NCT00152932,UNKNOWN,INTERVENTIONAL
NCT05955118,Hydrus Microstent as a Quality of Life Consideration,https://clinicaltrials.gov/study/NCT05955118,RECRUITING,OBSERVATIONAL
NCT05543018,Effect of Intraocular Tamponade on Visual Perception,https://clinicaltrials.gov/study/NCT05543018,RECRUITING,INTERVENTIONAL
NCT02300818,Effects of Magnetic Therapy and Seawater Combined in Decreasing Intraocular Presion.,https://clinicaltrials.gov/study/NCT02300818,UNKNOWN,INTERVENTIONAL
NCT00767494,Travoprost/Brinzolamide Fixed Combination Versus Travatan and Versus AZOPT,https://clinicaltrials.gov/study/NCT00767494,TERMINATED,INTERVENTIONAL
NCT04010994,Treatment of Patients With Optic Nerve Damage Patients Using Electrostimulation,https://clinicaltrials.gov/study/NCT04010994,UNKNOWN,INTERVENTIONAL
NCT05973318,Comparative Study of Dorzotimol Eye Drops 20 mg/mL + 5 mg/mL Versus Cosopt® Eye Drops 20 mg/mL + 5 mg/mL,https://clinicaltrials.gov/study/NCT05973318,COMPLETED,INTERVENTIONAL
NCT05704777,Exercise Intervention in Primary Open-angle Glaucoma,https://clinicaltrials.gov/study/NCT05704777,NOT_YET_RECRUITING,INTERVENTIONAL
NCT05704777,Exercise Intervention in Primary Open-angle Glaucoma,https://clinicaltrials.gov/study/NCT05704777,NOT_YET_RECRUITING,INTERVENTIONAL
NCT05704777,Exercise Intervention in Primary Open-angle Glaucoma,https://clinicaltrials.gov/study/NCT05704777,NOT_YET_RECRUITING,INTERVENTIONAL
NCT02226094,Safety and Efficacy of Deep Wave Trabeculoplasty (DWT) in Primary Open Angle Glaucoma and Ocular Hypertension,https://clinicaltrials.gov/study/NCT02226094,TERMINATED,INTERVENTIONAL
NCT00868894,Safety and Efficacy Study of DE-104 Ophthalmic Solution to Treat Open-angle Glaucoma or Ocular Hypertension,https://clinicaltrials.gov/study/NCT00868894,COMPLETED,INTERVENTIONAL
NCT03235232,BREMEN Eye Drops Versus Combigan for Open-angle Glaucoma or Intraocular Hypertension,https://clinicaltrials.gov/study/NCT03235232,RECRUITING,INTERVENTIONAL
NCT05697094,Impact of Meditation on Improving Quality of Life Among Glaucoma Patients: An Electronic Pilot Feasibility Study,https://clinicaltrials.gov/study/NCT05697094,NOT_YET_RECRUITING,INTERVENTIONAL
NCT04064918,Effects of Netarsudil and Timolol on Retinal Blood Vessel Density and Visual Acuity,https://clinicaltrials.gov/study/NCT04064918,WITHDRAWN,INTERVENTIONAL
NCT05159960,Optimal Treatment Protocol for Selective Laser Trabeculoplasty - Repeat Trial,https://clinicaltrials.gov/study/NCT05159960,ENROLLING_BY_INVITATION,INTERVENTIONAL
NCT04536129,Effects of Topical Low Dose Preservative-free Hydrocortisone on Intraocular Pressure,https://clinicaltrials.gov/study/NCT04536129,COMPLETED,INTERVENTIONAL
NCT00143429,Corneal Versus Conjunctival Delivery Using a Delivery Device,https://clinicaltrials.gov/study/NCT00143429,WITHDRAWN,INTERVENTIONAL
NCT05730478,Comparison Between Anterior Segment Optical Coherence Tomography and Ultrasound Bio Microscopy Parameters in Glaucoma Assessment,https://clinicaltrials.gov/study/NCT05730478,NOT_YET_RECRUITING,OBSERVATIONAL
NCT00557232,Intraocular Bevacizumab (Avastin) for Rubeosis Iridis,https://clinicaltrials.gov/study/NCT00557232,COMPLETED,INTERVENTIONAL
NCT00832832,Eyelid Closure in Glaucoma Therapy,https://clinicaltrials.gov/study/NCT00832832,COMPLETED,INTERVENTIONAL
NCT03417453,Eye Drop Dispensers: Safety Efficacy and Comfort.,https://clinicaltrials.gov/study/NCT03417453,UNKNOWN,INTERVENTIONAL
NCT01936129,Investigating the Neuroprotective Effect of Cop-1 (Copaxone) in Acute Primary Angle Closure,https://clinicaltrials.gov/study/NCT01936129,UNKNOWN,INTERVENTIONAL
NCT02697318,Evaluation of a New Method for Instilling Eye Drops,https://clinicaltrials.gov/study/NCT02697318,COMPLETED,INTERVENTIONAL
NCT05264818,Assessment of Endothelial Glycocalyx in Patients With Primary Open-angle Glaucoma,https://clinicaltrials.gov/study/NCT05264818,RECRUITING,OBSERVATIONAL
NCT01115218,The Influence of Anterior Chamber Fluid Mediators on the Success Rate of Trabeculectomy,https://clinicaltrials.gov/study/NCT01115218,COMPLETED,OBSERVATIONAL
NCT02325518,Comparison of Intraocular Pressure (IOP)-Lowering Efficacy and Safety of AZORGA® Ophthalmic Suspension and COSOPT® Ophthalmic Solution,https://clinicaltrials.gov/study/NCT02325518,COMPLETED,INTERVENTIONAL
NCT00821002,A Phase 2 Study of Punctal Placement of the Latanoprost Punctal Plug Delivery System (L-PPDS),https://clinicaltrials.gov/study/NCT00821002,COMPLETED,INTERVENTIONAL
NCT05913232,Study of Safety and Efficacy of H-1337 in Subjects With Primary Open Angle Glaucoma or Ocular Hypertension,https://clinicaltrials.gov/study/NCT05913232,RECRUITING,INTERVENTIONAL
NCT00307918,Acupuncture for Elevated Intraocular Pressure,https://clinicaltrials.gov/study/NCT00307918,TERMINATED,INTERVENTIONAL
NCT01175902,Intraocular Pressure and Ocular Perfusion Pressure of Cosopt in Normal Tension Glaucoma,https://clinicaltrials.gov/study/NCT01175902,COMPLETED,INTERVENTIONAL
NCT03187418,Treatment Outcomes of MicroPulse Trans-scleral Cyclophotocoagulation in Uncontrolled Glaucoma,https://clinicaltrials.gov/study/NCT03187418,COMPLETED,INTERVENTIONAL
NCT00650702,Safety and Efficacy of Punctum Plug Delivery System in Subjects With Open-Angle Glaucoma or Ocular Hypertension,https://clinicaltrials.gov/study/NCT00650702,COMPLETED,INTERVENTIONAL
NCT02868502,Different Glaucoma Treatments Effect on Intraocular Pressure Fluctuation With Postural Change in Eyes With Open-angle Glaucoma,https://clinicaltrials.gov/study/NCT02868502,UNKNOWN,OBSERVATIONAL
NCT01855802,Greek Physicians Perceptions Regarding Generics Prescribing in Glaucoma,https://clinicaltrials.gov/study/NCT01855802,COMPLETED,OBSERVATIONAL
NCT00811694,Neurovascular Coupling in Patients With Open Angle Glaucoma,https://clinicaltrials.gov/study/NCT00811694,TERMINATED,OBSERVATIONAL
NCT02209961,Combined Ex-PRESS Implantation Alone or With Phacoemulsification for Glaucoma Associated With Cataract,https://clinicaltrials.gov/study/NCT02209961,UNKNOWN,OBSERVATIONAL
NCT01737853,Comparison of Efficacy & Tolerability Between Ganfort vs Krytantek in Mexican Patients With Primary Open-Angle Glaucoma (POAG) or Ocular Hypertension (OHT),https://clinicaltrials.gov/study/NCT01737853,COMPLETED,OBSERVATIONAL
NCT05439161,XEN Glaucoma Gel Stent Versus Trabeculectomy,https://clinicaltrials.gov/study/NCT05439161,NOT_YET_RECRUITING,INTERVENTIONAL
NCT00448929,Ologen (OculusGen)-Glaucoma Case Control Trial in India,https://clinicaltrials.gov/study/NCT00448929,COMPLETED,INTERVENTIONAL
NCT00468429,Subconjunctival Bevacizumab to Prevent Bleb Failure After Glaucoma Filtration Surgery,https://clinicaltrials.gov/study/NCT00468429,UNKNOWN,INTERVENTIONAL
NCT01767753,IOP Fluctuations in Patients With Primary Open-angle Glaucoma Before and After Selective Laser Trabeculoplasty,https://clinicaltrials.gov/study/NCT01767753,COMPLETED,INTERVENTIONAL
NCT01494753,Pharmacokinetics Efficacy and Safety Assessment of T2345 Compared With Active Comparator in Newly Diagnosed Patients With Open-angle Glaucoma or Ocular Hypertension,https://clinicaltrials.gov/study/NCT01494753,COMPLETED,INTERVENTIONAL
NCT02388360,The Impact of Topical Prostaglandins on the Biomechanical Properties of the Cornea in Patients With Open Angle Glaucoma,https://clinicaltrials.gov/study/NCT02388360,COMPLETED,INTERVENTIONAL
NCT00404729,Neural Conduction Along the Visual Pathways After Oral Treatment With Citicoline in Patients With Optic Nerve Diseases,https://clinicaltrials.gov/study/NCT00404729,COMPLETED,INTERVENTIONAL
NCT03021629,Comparison of Vitamin D Status and Vitamin D Receptor Polymorphisms in Patients With High Myopia and Primary Open-angle Glaucoma,https://clinicaltrials.gov/study/NCT03021629,COMPLETED,OBSERVATIONAL
NCT00279253,Effects of Intravenous Clonidine on Ocular Blood Flow and Intraocular Pressure,https://clinicaltrials.gov/study/NCT00279253,COMPLETED,INTERVENTIONAL
NCT01682460,Pilot Study on the Use of Artificial Tears to Treat Dry Eye in Glaucoma Patients,https://clinicaltrials.gov/study/NCT01682460,COMPLETED,INTERVENTIONAL
NCT04769453,Multicenter Ab-interno Glaucoma Study Investigating Canaloplasty,https://clinicaltrials.gov/study/NCT04769453,TERMINATED,INTERVENTIONAL
NCT00503360,Tolerability Safety and Efficacy of SAD448 in Subjects With Ocular Hypertension,https://clinicaltrials.gov/study/NCT00503360,COMPLETED,INTERVENTIONAL
