NCT Number,Study Title,Study URL,Study_Status,Study Type
NCT03657797,Phase 2 Dose-Response Study Evaluating the Safety and Efficacy of NCX 470 vs Latanoprost in Subjects With Open-Angle Glaucoma or Ocular Hypertension,https://clinicaltrials.gov/study/NCT03657797,COMPLETED,INTERVENTIONAL
NCT04503590,Minimally Invasive Micro Sclerostomy: Performance and Safety Evaluation Study,https://clinicaltrials.gov/study/NCT04503590,COMPLETED,INTERVENTIONAL
NCT04303897,Real-world Evidence Study of XEN in Chinese Patients With Refractory Glaucoma,https://clinicaltrials.gov/study/NCT04303897,COMPLETED,OBSERVATIONAL
NCT03016156,Determination of the Sensitivity and Specificity of a Smartphone Application to Detect Retinoblastoma,https://clinicaltrials.gov/study/NCT03016156,RECRUITING,INTERVENTIONAL
NCT04503356,OMNI in Open-angle Glaucoma Treatment,https://clinicaltrials.gov/study/NCT04503356,UNKNOWN,INTERVENTIONAL
NCT02328456,Effect of SMS Reminder and Free Eye Drops on Follow-up Adherence After Trabeculectomy Surgery in Rural China,https://clinicaltrials.gov/study/NCT02328456,COMPLETED,INTERVENTIONAL
NCT00465803,A Phase IIIb Study of DuoTrav to Treat Glaucoma or Ocular Hypertension,https://clinicaltrials.gov/study/NCT00465803,COMPLETED,INTERVENTIONAL
NCT02526654,Heidelberg Edge Perimetry (HEP) Detecting Glaucomatous Visual Field Defects,https://clinicaltrials.gov/study/NCT02526654,COMPLETED,INTERVENTIONAL
NCT01312454,Safety and Intraocular Pressure (IOP) Lowering Effect of AL-59412C,https://clinicaltrials.gov/study/NCT01312454,TERMINATED,INTERVENTIONAL
NCT05498103,Use of Methazolamide to Lower Intraocular Pressure,https://clinicaltrials.gov/study/NCT05498103,RECRUITING,INTERVENTIONAL
NCT01159756,To Assess the Safety and Efficacy of Travacom in Patients With Uncontrolled Intraocular Pressure,https://clinicaltrials.gov/study/NCT01159756,COMPLETED,INTERVENTIONAL
NCT01886456,IOP Lowering Effect of PLT Versus SLT in Naiv OAG Patients,https://clinicaltrials.gov/study/NCT01886456,UNKNOWN,INTERVENTIONAL
NCT01922154,Intravitreous Ranibizumab as Adjunctive Treatment for Trabeculectomy in Neovascular Glaucoma,https://clinicaltrials.gov/study/NCT01922154,COMPLETED,INTERVENTIONAL
NCT00343603,Tracking Optical Coherence Tomography,https://clinicaltrials.gov/study/NCT00343603,COMPLETED,OBSERVATIONAL
NCT01883856,Comparison of Silicone and Porous Plate Ahmed Glaucoma Valves,https://clinicaltrials.gov/study/NCT01883856,COMPLETED,INTERVENTIONAL
NCT05875090,Glaucoma Portugal Screening Trial,https://clinicaltrials.gov/study/NCT05875090,ENROLLING_BY_INVITATION,INTERVENTIONAL
NCT05875090,Glaucoma Portugal Screening Trial,https://clinicaltrials.gov/study/NCT05875090,ENROLLING_BY_INVITATION,INTERVENTIONAL
NCT05875090,Glaucoma Portugal Screening Trial,https://clinicaltrials.gov/study/NCT05875090,ENROLLING_BY_INVITATION,INTERVENTIONAL
NCT05875090,Glaucoma Portugal Screening Trial,https://clinicaltrials.gov/study/NCT05875090,ENROLLING_BY_INVITATION,INTERVENTIONAL
NCT05898997,Regulation of Intraocular Pressure in Glaucoma Patients by Acupressure,https://clinicaltrials.gov/study/NCT05898997,NOT_YET_RECRUITING,INTERVENTIONAL
NCT02846090,Dexmedetomidine as an Additive to Local Anaesthesia to Decrease Intraocular Pressure in Glaucoma Surgery,https://clinicaltrials.gov/study/NCT02846090,UNKNOWN,INTERVENTIONAL
NCT01456390,Open-Angle Glaucoma Subjects With One Prior Trabeculectomy Treated Concurrently With One Suprachoroidal Stent and Two Trabecular Micro-bypass Stents,https://clinicaltrials.gov/study/NCT01456390,COMPLETED,INTERVENTIONAL
NCT02744690,Mitomycin C Trabeculectomy Trial for Glaucoma in Ethiopia,https://clinicaltrials.gov/study/NCT02744690,WITHDRAWN,INTERVENTIONAL
NCT03076697,Smartphone Screening for Eye Diseases,https://clinicaltrials.gov/study/NCT03076697,ENROLLING_BY_INVITATION,OBSERVATIONAL
NCT03076697,Smartphone Screening for Eye Diseases,https://clinicaltrials.gov/study/NCT03076697,ENROLLING_BY_INVITATION,OBSERVATIONAL
NCT02355990,Minimally Invasive Micro Sclerostomy First in Man Safety and Preliminary Performance Study,https://clinicaltrials.gov/study/NCT02355990,COMPLETED,INTERVENTIONAL
NCT05674890,SmartSystem Virtual Reality Headset Perimeter Versus Humphrey HFA-III Perimeter,https://clinicaltrials.gov/study/NCT05674890,RECRUITING,INTERVENTIONAL
NCT01111890,Comparison of the Efficacy of AZARGA® Versus COSOPT® in Patients With Open-Angled Glaucoma or Ocular Hypertension,https://clinicaltrials.gov/study/NCT01111890,COMPLETED,INTERVENTIONAL
NCT00928590,Safety Study of DuoTrav APS in Patients With Open-Angle Glaucoma or Ocular Hypertension,https://clinicaltrials.gov/study/NCT00928590,COMPLETED,INTERVENTIONAL
NCT06045390,An App-based Instructional Platform to Improve Eye Drop Recall,https://clinicaltrials.gov/study/NCT06045390,NOT_YET_RECRUITING,INTERVENTIONAL
NCT00701597,Effects of Non-Specific Endothelin-A Receptor Blockade on Ocular Blood Flow in Patients With Glaucoma,https://clinicaltrials.gov/study/NCT00701597,COMPLETED,INTERVENTIONAL
NCT00854256,Trabeculectomy Versus Canaloplasty to Treat Glaucoma,https://clinicaltrials.gov/study/NCT00854256,UNKNOWN,INTERVENTIONAL
NCT03220490,Efficacy and Necessity of Time Interval Between Instillation of Two Glaucoma Eye Drops,https://clinicaltrials.gov/study/NCT03220490,UNKNOWN,INTERVENTIONAL
NCT04931290,Supracapsular Ahmed Glaucoma Valve Plate Delivery Technique for Management of Encapsulated Bleb in Pediatric Patients,https://clinicaltrials.gov/study/NCT04931290,COMPLETED,INTERVENTIONAL
NCT02054403,Angle Closure (Glaucoma) in Caucasians,https://clinicaltrials.gov/study/NCT02054403,UNKNOWN,OBSERVATIONAL
NCT00061503,Mechanism of Action of TRAVATAN 0.004% in Subjects With Glaucoma or Ocular Hypertension,https://clinicaltrials.gov/study/NCT00061503,COMPLETED,INTERVENTIONAL
NCT00320203,Anecortave Acetate in Patients With Open-angle Glaucoma,https://clinicaltrials.gov/study/NCT00320203,COMPLETED,INTERVENTIONAL
NCT05136950,Incidence of Glaucoma-related Adverse Events in Pediatric Secondary Intraocular Lens Implantation,https://clinicaltrials.gov/study/NCT05136950,RECRUITING,INTERVENTIONAL
NCT00047515,Phase 3 Study to Evaluate IOP Lowering Therapy in Open Angle Glaucoma and Ocular Hypertension C-01-69,https://clinicaltrials.gov/study/NCT00047515,COMPLETED,INTERVENTIONAL
NCT01840215,Study on the Impact of Ocular Anesthetic Procedures in Ocular Blood Flow,https://clinicaltrials.gov/study/NCT01840215,COMPLETED,OBSERVATIONAL
NCT01818115,Safety and Efficacy Trial to Evaluate the Hydrus(TM) Implant in Subjects Undergoing Cataract Surgery.,https://clinicaltrials.gov/study/NCT01818115,COMPLETED,INTERVENTIONAL
NCT02287545,Biomechanical Changes After Trabeculectomy,https://clinicaltrials.gov/study/NCT02287545,COMPLETED,OBSERVATIONAL
NCT04593745,Intraocular Pressure in Children With Acute Lymphoblastic Leukemia (ALL) Treated With High Dose Steroids,https://clinicaltrials.gov/study/NCT04593745,RECRUITING,INTERVENTIONAL
NCT00051168,A Long-term Safety Study of Once-daily Travatan,https://clinicaltrials.gov/study/NCT00051168,COMPLETED,INTERVENTIONAL
NCT02231515,ProspectiveRandomizedControlled Study to Assess EfficacySafety and Tolerability of SLT vs. PLT in Patients With POAG,https://clinicaltrials.gov/study/NCT02231515,TERMINATED,INTERVENTIONAL
NCT02647515,Intravitreal Ranibizumab Injection as Adjuvant in the Treatment of Postvitrectomy Diabetic Vitreous Hemorrhage Accompanied by Neovascular Glaucoma,https://clinicaltrials.gov/study/NCT02647515,COMPLETED,INTERVENTIONAL
NCT04671550,The Value of Visual Field Examination in Driving Licence.,https://clinicaltrials.gov/study/NCT04671550,UNKNOWN,OBSERVATIONAL
NCT02855450,Study to Evaluate Safety and Efficacy of rhNGF Eye Drops Solution Versus Vehicle in Patients With Glaucoma,https://clinicaltrials.gov/study/NCT02855450,COMPLETED,INTERVENTIONAL
NCT04116450,MicrocatheterTrabeculotomy in Primary Congenital Glaucoma,https://clinicaltrials.gov/study/NCT04116450,COMPLETED,INTERVENTIONAL
NCT03488550,Single-dose Study of ANX007 in Participants With Primary Open-angle Glaucoma,https://clinicaltrials.gov/study/NCT03488550,COMPLETED,INTERVENTIONAL
NCT01733550,ICare Self-tonometry - A Head-to-head Comparison to the Gold Standard Goldmann Tonometer,https://clinicaltrials.gov/study/NCT01733550,UNKNOWN,OBSERVATIONAL
NCT01677507,Glaucoma Biomarkers,https://clinicaltrials.gov/study/NCT01677507,COMPLETED,INTERVENTIONAL
NCT01677507,Glaucoma Biomarkers,https://clinicaltrials.gov/study/NCT01677507,COMPLETED,INTERVENTIONAL
NCT01677507,Glaucoma Biomarkers,https://clinicaltrials.gov/study/NCT01677507,COMPLETED,INTERVENTIONAL
NCT00453024,Imaging Ahmed Glaucoma Tubes With a Pericardial Graft and Tissue Glue or Partial-Thickness Scleral Flap and Sutures,https://clinicaltrials.gov/study/NCT00453024,UNKNOWN,INTERVENTIONAL
NCT01025024,Investigation of Genetic Disease Marker Associated With Korean Glaucoma Patients,https://clinicaltrials.gov/study/NCT01025024,COMPLETED,OBSERVATIONAL
NCT01025024,Investigation of Genetic Disease Marker Associated With Korean Glaucoma Patients,https://clinicaltrials.gov/study/NCT01025024,COMPLETED,OBSERVATIONAL
NCT01898624,Specified Drug Use-results Survey of Betanis Tablets,https://clinicaltrials.gov/study/NCT01898624,COMPLETED,OBSERVATIONAL
NCT00551395,Timing of Treatment Completion in Staged Selective Laser Trabeculoplasty (SLT): Early vs. Late Completion,https://clinicaltrials.gov/study/NCT00551395,TERMINATED,INTERVENTIONAL
NCT02655432,Performance of a Photoscreener for Vision Screening in a Haitian Pediatric Population,https://clinicaltrials.gov/study/NCT02655432,WITHDRAWN,OBSERVATIONAL
NCT06144918,Phase 2 Placebo-Controlled Study Assessing the Safety and Ocular Efficacy of SBI-100 Ophthalmic Emulsion in Patients With Elevated Eye Pressure,https://clinicaltrials.gov/study/NCT06144918,RECRUITING,INTERVENTIONAL
NCT05506423,Study of the CycloPen Micro-Interventional System and Long-Term Clinical Outcomes,https://clinicaltrials.gov/study/NCT05506423,ENROLLING_BY_INVITATION,OBSERVATIONAL
NCT05039684,Inflammatory Biomarkers in Ocular Surface in Primary Open Angle Glaucoma or Ocular Hypertension Under Topical Prostaglandins,https://clinicaltrials.gov/study/NCT05039684,RECRUITING,OBSERVATIONAL
NCT01887223,Transconjunctival Needling Revision Versus Medical Treatment,https://clinicaltrials.gov/study/NCT01887223,COMPLETED,INTERVENTIONAL
NCT01087684,Response to SLT vs. ALT in Patients Under 60 Years of Age,https://clinicaltrials.gov/study/NCT01087684,COMPLETED,INTERVENTIONAL
NCT01840202,Ocular Blood Flow in Glaucoma Patients - the Leuven Eye Study,https://clinicaltrials.gov/study/NCT01840202,COMPLETED,OBSERVATIONAL
NCT00940823,The AVB Study: Prospective Study Comparing the Ahmed Valve and the Baerveldt Implant for Treating Refractory Glaucoma,https://clinicaltrials.gov/study/NCT00940823,COMPLETED,INTERVENTIONAL
NCT05231928,A Novel Argon Laser Iridoplasty for Pigment Dispersion Syndrome,https://clinicaltrials.gov/study/NCT05231928,RECRUITING,INTERVENTIONAL
NCT03584958,Comparing Refractive and Visual Outcomes of MIGS and Traditional Surgeries,https://clinicaltrials.gov/study/NCT03584958,ENROLLING_BY_INVITATION,OBSERVATIONAL
NCT03584958,Comparing Refractive and Visual Outcomes of MIGS and Traditional Surgeries,https://clinicaltrials.gov/study/NCT03584958,ENROLLING_BY_INVITATION,OBSERVATIONAL
NCT01105923,Study of an Intervention to Improve Problem List Accuracy and Use,https://clinicaltrials.gov/study/NCT01105923,UNKNOWN,INTERVENTIONAL
NCT00323284,A Study of the Trabecular Micro-bypass Stent in Combination With Cataract Surgery in Subjects With Open Angle Glaucoma,https://clinicaltrials.gov/study/NCT00323284,COMPLETED,INTERVENTIONAL
NCT00332384,Safety and Efficacy Study of Brimonidine/Timolol Fixed Combination in Patients With Glaucoma or Ocular Hypertension,https://clinicaltrials.gov/study/NCT00332384,COMPLETED,INTERVENTIONAL
NCT00444184,24-hour Intraocular Pressure Control With Travoprost/Timolol Fixed Combination Versus Travoprost,https://clinicaltrials.gov/study/NCT00444184,COMPLETED,INTERVENTIONAL
NCT01430923,Clinical Evaluation of Safety and Efficacy of Refrigeration Free Latanoprost,https://clinicaltrials.gov/study/NCT01430923,UNKNOWN,INTERVENTIONAL
NCT01417858,Intraocular Pressure Control After Anterior Segment Laser - Comparison Between 2 Drugs,https://clinicaltrials.gov/study/NCT01417858,UNKNOWN,INTERVENTIONAL
NCT03423758,Investigating the Genetic Basis of Pseudoexfoliation Syndrome Angle-closure Glaucoma and Primary Open-angle Glaucoma,https://clinicaltrials.gov/study/NCT03423758,RECRUITING,OBSERVATIONAL
NCT04602923,Keratometric Change After XEN Trabeculectomy and Tube Shunts,https://clinicaltrials.gov/study/NCT04602923,RECRUITING,INTERVENTIONAL
NCT02390284,Stop Retinal Ganglion Cell Dysfunction Study,https://clinicaltrials.gov/study/NCT02390284,ACTIVE_NOT_RECRUITING,INTERVENTIONAL
NCT03912584,Study Comparing the P200TE and the P200TxE in Glaucoma Patients,https://clinicaltrials.gov/study/NCT03912584,COMPLETED,INTERVENTIONAL
NCT00494923,Early Diagnosis Pathogenesis and Progression of Open Angle Glaucoma,https://clinicaltrials.gov/study/NCT00494923,UNKNOWN,OBSERVATIONAL
NCT01507584,The Effects of the Water Drinking Test on Intraocular Pressure,https://clinicaltrials.gov/study/NCT01507584,COMPLETED,INTERVENTIONAL
NCT04037384,Training of Eye Movements in Glaucoma,https://clinicaltrials.gov/study/NCT04037384,UNKNOWN,INTERVENTIONAL
NCT01230736,Safety and Efficacy of Changing to DuoTrav From Prior Therapy,https://clinicaltrials.gov/study/NCT01230736,COMPLETED,INTERVENTIONAL
NCT00848536,Efficacy Study of Travoprost APS Versus TRAVATAN,https://clinicaltrials.gov/study/NCT00848536,COMPLETED,INTERVENTIONAL
NCT00527501,IOP Lowering Efficacy of Travoprost/Brinzolamide Fixed Combination Ophthalmic Suspension in Patients With Open-Angle Glaucoma or Ocular Hypertension,https://clinicaltrials.gov/study/NCT00527501,COMPLETED,INTERVENTIONAL
NCT00559234,Potential Research Participants for Future Studies of Inherited Eye Diseases,https://clinicaltrials.gov/study/NCT00559234,COMPLETED,OBSERVATIONAL
NCT05503901,A Long Term Study of STN1012600 in Subjects With Open Angle Glaucoma or Ocular Hypertension,https://clinicaltrials.gov/study/NCT05503901,RECRUITING,INTERVENTIONAL
NCT01849536,Corneal Biomechanics and Continuous IOP Monitoring Using Soft Contact Lenses in Glaucomatous Patients,https://clinicaltrials.gov/study/NCT01849536,COMPLETED,INTERVENTIONAL
NCT00332436,Safety and Efficacy Study of Brimonidine/Timolol Fixed Combination in Patients With Glaucoma or Ocular Hypertension,https://clinicaltrials.gov/study/NCT00332436,COMPLETED,INTERVENTIONAL
NCT04205201,The Effectiveness of Topical Latanoprost Compared With Topical Brimonidine in the Treatment of the Primary Open Angle Glaucoma,https://clinicaltrials.gov/study/NCT04205201,COMPLETED,INTERVENTIONAL
NCT03651336,Long-term Safety and Performance of the ARGOS-IO Intraocular Pressure Sensor System in Subjects With Primary Open Angle Glaucoma (POAG),https://clinicaltrials.gov/study/NCT03651336,COMPLETED,INTERVENTIONAL
NCT05253534,GlaucoT Glaucoma Treatment Glasses in the Treatment of Primary Open-Angle Glaucoma,https://clinicaltrials.gov/study/NCT05253534,SUSPENDED,INTERVENTIONAL
NCT04784234,Vision Preservation and Restoration Following a 6 Month Trial of GlaucoCetin,https://clinicaltrials.gov/study/NCT04784234,RECRUITING,INTERVENTIONAL
NCT04038034,Valuation of the Antioxidant and Neuroprotective Effects of CoQ10-MINIACTIVES® (COQUN® OS) in Patients Affected by Primary Open Angle Glaucoma,https://clinicaltrials.gov/study/NCT04038034,UNKNOWN,INTERVENTIONAL
NCT05536401,P200TE Agreement and Precision Study,https://clinicaltrials.gov/study/NCT05536401,TERMINATED,INTERVENTIONAL
NCT04735601,Ahmed Valve Implantation Coated With Poly Lactic -Co-glycolic Acid (PLGA) Saturated With Mitomycin-C in the Management of Adult Onset Glaucoma in Sturge Weber Syndrome,https://clinicaltrials.gov/study/NCT04735601,RECRUITING,INTERVENTIONAL
NCT04285580,A Phase 3b Study Evaluating the 24-Hour Intraocular Pressure Lowering Effect of Bimatoprost SR in Patients With Open-Angle Glaucoma or Ocular Hypertension,https://clinicaltrials.gov/study/NCT04285580,COMPLETED,INTERVENTIONAL
NCT01896180,Study to Compare the Safety and Efficacy of ALZ-1101 to Latanoprost in Patients With Intraocular Pressure Inadequately Controlled by Latanoprost,https://clinicaltrials.gov/study/NCT01896180,COMPLETED,INTERVENTIONAL
NCT04947124,A Study to Determine the Safety and Tolerability of 2 Concentrations of QLS-101,https://clinicaltrials.gov/study/NCT04947124,COMPLETED,INTERVENTIONAL
NCT05147701,Safety of Cultured Allogeneic Adult Umbilical Cord Derived Mesenchymal Stem Cells for Eye Diseases,https://clinicaltrials.gov/study/NCT05147701,RECRUITING,INTERVENTIONAL
NCT03338101,Comparative Study Between Tonometers,https://clinicaltrials.gov/study/NCT03338101,COMPLETED,OBSERVATIONAL
NCT01879501,Living Successfully With Chronic Eye Diseases,https://clinicaltrials.gov/study/NCT01879501,UNKNOWN,INTERVENTIONAL
NCT01879501,Living Successfully With Chronic Eye Diseases,https://clinicaltrials.gov/study/NCT01879501,UNKNOWN,INTERVENTIONAL
NCT01879501,Living Successfully With Chronic Eye Diseases,https://clinicaltrials.gov/study/NCT01879501,UNKNOWN,INTERVENTIONAL
NCT01879501,Living Successfully With Chronic Eye Diseases,https://clinicaltrials.gov/study/NCT01879501,UNKNOWN,INTERVENTIONAL
NCT02050880,OCT Agreement and Crossed Precision Study,https://clinicaltrials.gov/study/NCT02050880,COMPLETED,OBSERVATIONAL
NCT05703724,Prevalence of Glaucoma in Belgium: a Multicenter National Trial,https://clinicaltrials.gov/study/NCT05703724,COMPLETED,INTERVENTIONAL
NCT01628601,GANfort® in Patients With Primary Open Angle Glaucoma or Ocular Hypertension Who Are Insufficiently Responsive to Monotherapy,https://clinicaltrials.gov/study/NCT01628601,COMPLETED,OBSERVATIONAL
NCT04132401,AI for the Detection of Retinal Disease and Glaucoma in Patients With Diabetes Mellitus in Primary Care,https://clinicaltrials.gov/study/NCT04132401,COMPLETED,INTERVENTIONAL
NCT04132401,AI for the Detection of Retinal Disease and Glaucoma in Patients With Diabetes Mellitus in Primary Care,https://clinicaltrials.gov/study/NCT04132401,COMPLETED,INTERVENTIONAL
NCT04132401,AI for the Detection of Retinal Disease and Glaucoma in Patients With Diabetes Mellitus in Primary Care,https://clinicaltrials.gov/study/NCT04132401,COMPLETED,INTERVENTIONAL
NCT05269680,STAR-LIFE: a Post-market Registry on MINIject,https://clinicaltrials.gov/study/NCT05269680,RECRUITING,OBSERVATIONAL
NCT04448080,Comparison of Topical Anesthesia and Analgosedation in Micropulse Transscleral Glaucoma Treatment,https://clinicaltrials.gov/study/NCT04448080,COMPLETED,INTERVENTIONAL
NCT06174324,Visual Field Progression and RNFL Change After PreserFlo MicroShunt Implantation,https://clinicaltrials.gov/study/NCT06174324,RECRUITING,OBSERVATIONAL
NCT00443924,Study of INS115644 Ophthalmic Solution in Subjects With Ocular Hypertension or Glaucoma,https://clinicaltrials.gov/study/NCT00443924,COMPLETED,INTERVENTIONAL
NCT03750201,A Study to Assess an Automated Laser Device for Direct Selective Laser Trabeculoplasty,https://clinicaltrials.gov/study/NCT03750201,COMPLETED,INTERVENTIONAL
NCT03750201,A Study to Assess an Automated Laser Device for Direct Selective Laser Trabeculoplasty,https://clinicaltrials.gov/study/NCT03750201,COMPLETED,INTERVENTIONAL
NCT03750201,A Study to Assess an Automated Laser Device for Direct Selective Laser Trabeculoplasty,https://clinicaltrials.gov/study/NCT03750201,COMPLETED,INTERVENTIONAL
NCT03750201,A Study to Assess an Automated Laser Device for Direct Selective Laser Trabeculoplasty,https://clinicaltrials.gov/study/NCT03750201,COMPLETED,INTERVENTIONAL
NCT00327301,Cellular Proteome From Leukocytes of Glaucoma Patients in Comparison With Patients With Parkinson's Disease,https://clinicaltrials.gov/study/NCT00327301,WITHDRAWN,OBSERVATIONAL
NCT06000280,Evaluation of Retina in Patients With Glaucoma Using Topical Prostaglandins Undergoing Trabeculectomy Surgery,https://clinicaltrials.gov/study/NCT06000280,COMPLETED,INTERVENTIONAL
NCT03310580,Study of Netarsudil Ophthalmic Solution in Japanese/Japanese-American Subjects With Open-angle Glaucoma or Ocular Hypertension,https://clinicaltrials.gov/study/NCT03310580,COMPLETED,INTERVENTIONAL
NCT00644280,Ranibizumab in Preventing Failure of Ahmed Valve Glaucoma Surgery,https://clinicaltrials.gov/study/NCT00644280,TERMINATED,INTERVENTIONAL
NCT01561001,IOP Fluctuations in Primary Open Angle Glaucoma Patients Before and After Deep Sclerectomy With Collagen Implant,https://clinicaltrials.gov/study/NCT01561001,TERMINATED,INTERVENTIONAL
NCT03086980,Automatic Self Transcending Meditation (ASTM) Versus Usual Care in Patients With Glaucoma,https://clinicaltrials.gov/study/NCT03086980,UNKNOWN,INTERVENTIONAL
NCT02875158,Cyclophotocoagulation in Glaucoma,https://clinicaltrials.gov/study/NCT02875158,COMPLETED,INTERVENTIONAL
NCT00221923,African Descent and Glaucoma Evaluation Study,https://clinicaltrials.gov/study/NCT00221923,UNKNOWN,OBSERVATIONAL
NCT01170884,Comparing Safety and Efficacy of Combigan® and Lumigan® With Lumigan® Alone in Glaucoma or Ocular Hypertension Subjects Treated With Xalatan®,https://clinicaltrials.gov/study/NCT01170884,COMPLETED,INTERVENTIONAL
NCT01391078,Comparison of Sensimed Triggerfish With Goldmann Applanation Tonometry and Perkins Tonometry,https://clinicaltrials.gov/study/NCT01391078,COMPLETED,INTERVENTIONAL
NCT04553523,Hydrus® Microstent New Enrollment Post-Approval Study,https://clinicaltrials.gov/study/NCT04553523,RECRUITING,INTERVENTIONAL
NCT02339584,Efficacy and Safety of Brinzolamide/Brimonidine Fixed Combination BID Compared to Brinzolamide BID Plus Brimonidine BID in Subjects With Open-Angle Glaucoma (OAG) or Ocular Hypertension (OHT),https://clinicaltrials.gov/study/NCT02339584,COMPLETED,INTERVENTIONAL
NCT03931564,SIGHT Study: Cost-effectiveness of InnFocus Microshunt Implantation vs. Trabeculectomy.,https://clinicaltrials.gov/study/NCT03931564,RECRUITING,INTERVENTIONAL
NCT02917564,Triamcinolone Injections for Persistent Choroidal Effusions Post Glaucoma Surgery,https://clinicaltrials.gov/study/NCT02917564,RECRUITING,INTERVENTIONAL
NCT03624361,MINIject Glaucoma Implant in European Patients,https://clinicaltrials.gov/study/NCT03624361,COMPLETED,INTERVENTIONAL
NCT03274323,Trabeculectomy Versus 2-iStent and Prostaglandin Study,https://clinicaltrials.gov/study/NCT03274323,WITHDRAWN,INTERVENTIONAL
NCT04530084,A Single Center Proof Of Concept Study To Assess Intra And Perioperative Safety Profile Of OMNI Surgical System,https://clinicaltrials.gov/study/NCT04530084,UNKNOWN,INTERVENTIONAL
NCT04088084,Effects of Palmitoylethanolamide on Inner Retinal Function in Glaucoma Patients by Pattern Electroretinogram,https://clinicaltrials.gov/study/NCT04088084,COMPLETED,INTERVENTIONAL
NCT00801658,Efficacy of SLT in Patients With Insufficient IOP Control Under Maximum Tolerated Drug Therapy (Eye Drops),https://clinicaltrials.gov/study/NCT00801658,COMPLETED,INTERVENTIONAL
NCT02199158,Short-term Outcomes of Iridoplasty for Persistent Angle Closure Despite Patent Iridotomies,https://clinicaltrials.gov/study/NCT02199158,COMPLETED,INTERVENTIONAL
NCT01052558,GTS400 Stent Implantation in Conjunction With Cataract Surgery in Subjects With Open-angle Glaucoma,https://clinicaltrials.gov/study/NCT01052558,COMPLETED,INTERVENTIONAL
NCT02405884,Intraocular Pressure and Hemodialysis Midwestern Brazil,https://clinicaltrials.gov/study/NCT02405884,COMPLETED,INTERVENTIONAL
NCT01779284,Travoprost/Timolol vs Latanoprost/Timolol Fixed Combination Therapy,https://clinicaltrials.gov/study/NCT01779284,COMPLETED,INTERVENTIONAL
NCT00847158,A Clinical Trial of Phacoemulsification Versus Phacoemulsification & the iStent Implantation in POAG Patients,https://clinicaltrials.gov/study/NCT00847158,COMPLETED,INTERVENTIONAL
NCT04878458,Phacotrabeculectomy Versus Phacogoniotomy (PVP) in Advanced Primary Angle-closure Glaucoma,https://clinicaltrials.gov/study/NCT04878458,ACTIVE_NOT_RECRUITING,INTERVENTIONAL
NCT04878458,Phacotrabeculectomy Versus Phacogoniotomy (PVP) in Advanced Primary Angle-closure Glaucoma,https://clinicaltrials.gov/study/NCT04878458,ACTIVE_NOT_RECRUITING,INTERVENTIONAL
NCT04878458,Phacotrabeculectomy Versus Phacogoniotomy (PVP) in Advanced Primary Angle-closure Glaucoma,https://clinicaltrials.gov/study/NCT04878458,ACTIVE_NOT_RECRUITING,INTERVENTIONAL
NCT04878458,Phacotrabeculectomy Versus Phacogoniotomy (PVP) in Advanced Primary Angle-closure Glaucoma,https://clinicaltrials.gov/study/NCT04878458,ACTIVE_NOT_RECRUITING,INTERVENTIONAL
NCT04878458,Phacotrabeculectomy Versus Phacogoniotomy (PVP) in Advanced Primary Angle-closure Glaucoma,https://clinicaltrials.gov/study/NCT04878458,ACTIVE_NOT_RECRUITING,INTERVENTIONAL
NCT04878458,Phacotrabeculectomy Versus Phacogoniotomy (PVP) in Advanced Primary Angle-closure Glaucoma,https://clinicaltrials.gov/study/NCT04878458,ACTIVE_NOT_RECRUITING,INTERVENTIONAL
NCT04878458,Phacotrabeculectomy Versus Phacogoniotomy (PVP) in Advanced Primary Angle-closure Glaucoma,https://clinicaltrials.gov/study/NCT04878458,ACTIVE_NOT_RECRUITING,INTERVENTIONAL
NCT04060758,Open Label Sequential-dose Study of PA5108 Latanoprost FA SR Ocular Implant for Mild-moderate Glaucoma,https://clinicaltrials.gov/study/NCT04060758,RECRUITING,INTERVENTIONAL
NCT06139523,Optimize Pediatric OCT Imaging,https://clinicaltrials.gov/study/NCT06139523,NOT_YET_RECRUITING,OBSERVATIONAL
NCT00348023,Bimatoprost Monotherapy vs. Dual Therapy With Travoprost and Timolol in Patients With Glaucoma and Ocular Hypertension,https://clinicaltrials.gov/study/NCT00348023,COMPLETED,INTERVENTIONAL
