NCT Number,Study Title,Study URL,Study_Status,Study Type
NCT03978546,Diagnostic Performance of Smart Supra Perimetry (The DPSSP Study),https://clinicaltrials.gov/study/NCT03978546,COMPLETED,INTERVENTIONAL
NCT03978546,Diagnostic Performance of Smart Supra Perimetry (The DPSSP Study),https://clinicaltrials.gov/study/NCT03978546,COMPLETED,INTERVENTIONAL
NCT03868462,Optos P200TE Agreement and Precision Study,https://clinicaltrials.gov/study/NCT03868462,COMPLETED,INTERVENTIONAL
NCT02338362,Inhaled Corticosteroids: Effect on Intraocular Pressure in Patients With Controlled Glaucoma,https://clinicaltrials.gov/study/NCT02338362,COMPLETED,INTERVENTIONAL
NCT03921372,Isometric Exercise in NTG,https://clinicaltrials.gov/study/NCT03921372,COMPLETED,INTERVENTIONAL
NCT01912638,Trabeculectomy With Ologen Collagen Implant vs Trabeculectomy With Provisc in Steroid Induced Glaucoma,https://clinicaltrials.gov/study/NCT01912638,COMPLETED,INTERVENTIONAL
NCT03756662,Performance and Safety of the ARGOS-SC01 Suprachoroidal Pressure Sensor in Patients With Glaucoma Undergoing Non-penetrating Glaucoma Surgery,https://clinicaltrials.gov/study/NCT03756662,COMPLETED,INTERVENTIONAL
NCT00140062,Efficacy And Safety Of Xalatan Compared To Usual Care In Patients With Open Angle Glaucoma Or Ocular Hypertension.,https://clinicaltrials.gov/study/NCT00140062,COMPLETED,INTERVENTIONAL
NCT00913562,Effect of Rosuvastatin on Endothelial Function in Patients With Diabetes and Glaucoma,https://clinicaltrials.gov/study/NCT00913562,WITHDRAWN,INTERVENTIONAL
NCT02384772,Survey of Patients Taking IOP-Lowering Eye Drops,https://clinicaltrials.gov/study/NCT02384772,COMPLETED,OBSERVATIONAL
NCT01180062,Safety Study of Latanoprost Slow Release Insert,https://clinicaltrials.gov/study/NCT01180062,TERMINATED,INTERVENTIONAL
NCT00956462,Steroids Versus Non-steroidal Anti-inflammatory Drugs Following Glaucoma Surgery,https://clinicaltrials.gov/study/NCT00956462,UNKNOWN,INTERVENTIONAL
NCT01363362,Selective Lasertrabeculoplasty and Ocular Hemodynamics in Glaucoma,https://clinicaltrials.gov/study/NCT01363362,COMPLETED,INTERVENTIONAL
NCT02028572,Structure Function Correlation in Primary Open Angle Glaucoma,https://clinicaltrials.gov/study/NCT02028572,COMPLETED,OBSERVATIONAL
NCT03691662,A Phase III Study Assessing the Efficacy and Safety of DE-117 Ophthalmic Solution Compared With Timolol Maleate Ophthalmic Solution 0.5% in Subjects With Glaucoma or Ocular Hypertension - Spectrum 4 Study,https://clinicaltrials.gov/study/NCT03691662,COMPLETED,INTERVENTIONAL
NCT01348672,Prospective Study Phase: Retinal Oxygen Saturation Blood Flow Vascular Function and High Resolution Morphometric Imaging in the Living Human Eye,https://clinicaltrials.gov/study/NCT01348672,UNKNOWN,OBSERVATIONAL
NCT00533962,IOP Reduction After Anecortave Acetate Injection in Glaucoma Patients,https://clinicaltrials.gov/study/NCT00533962,UNKNOWN,INTERVENTIONAL
NCT04019210,Modified Trabeculectomy for Glaucoma Surgery,https://clinicaltrials.gov/study/NCT04019210,UNKNOWN,INTERVENTIONAL
NCT05532410,Optic Disc Photograph Collection Study,https://clinicaltrials.gov/study/NCT05532410,COMPLETED,INTERVENTIONAL
NCT04912310,Efficacy Evaluation and Influencing Factors of Argon Laser Peripheral Iridoplasty in Acute Angle Closure Glaucoma,https://clinicaltrials.gov/study/NCT04912310,UNKNOWN,INTERVENTIONAL
NCT03797846,Comparison of Fixation Suture Type in Glaucoma Surgery,https://clinicaltrials.gov/study/NCT03797846,COMPLETED,INTERVENTIONAL
NCT00750646,Observational Study of How Patients Take Eye Drops,https://clinicaltrials.gov/study/NCT00750646,UNKNOWN,OBSERVATIONAL
NCT01282346,SOLX Gold Shunt for Refractory Glaucoma,https://clinicaltrials.gov/study/NCT01282346,COMPLETED,INTERVENTIONAL
NCT03318146,Safety Tolerability and Preliminary Efficacy of Unilateral Latanoprost-loaded Punctual Plug -EXP-LP,https://clinicaltrials.gov/study/NCT03318146,UNKNOWN,INTERVENTIONAL
NCT01637246,A Study of Patients With Primary Open Angle Glaucoma or Ocular Hypertension Who Were Insufficiently Responsive to Monotherapy,https://clinicaltrials.gov/study/NCT01637246,COMPLETED,OBSERVATIONAL
NCT03267862,Scleral Response to Intraocular Pressure (IOP),https://clinicaltrials.gov/study/NCT03267862,COMPLETED,OBSERVATIONAL
NCT05147610,Precision of the Icare200 for Measuring Intraocular Pressure,https://clinicaltrials.gov/study/NCT05147610,COMPLETED,INTERVENTIONAL
NCT01895972,Long-Term Safety of Latanoprostene Bunod Ophthalmic Solution 0.024% in Japanese Subjects With OAG or OHT,https://clinicaltrials.gov/study/NCT01895972,COMPLETED,INTERVENTIONAL
NCT00892762,Travoprost APS Versus Xalatan® in Patient Reported Outcomes and Ocular Surface Health,https://clinicaltrials.gov/study/NCT00892762,COMPLETED,INTERVENTIONAL
NCT00332072,Safety and Efficacy Study of Bimatoprost/Timolol Fixed Combination in Patients Wtih Glaucoma or Ocular Hypertension,https://clinicaltrials.gov/study/NCT00332072,COMPLETED,INTERVENTIONAL
NCT02312362,High Frequency Deep Sclerotomy (HFDS) ab Interno a Combination Surgical Intervention Using Cataract Surgery to Lower IOP,https://clinicaltrials.gov/study/NCT02312362,UNKNOWN,INTERVENTIONAL
NCT00788762,Myocilin Variations and Familial Glaucoma in Taxiarchis,https://clinicaltrials.gov/study/NCT00788762,UNKNOWN,OBSERVATIONAL
NCT01781962,A Study of Quantitative Assessments of Angle Width in Chinese Patients With Open-angle Glaucoma and/or Ocular Hypertension,https://clinicaltrials.gov/study/NCT01781962,TERMINATED,OBSERVATIONAL
NCT03094910,Investigation of the Rewarming og the Fingers After Cooling and the Autonomic Nervous System in Raynaud's Phenomenon,https://clinicaltrials.gov/study/NCT03094910,COMPLETED,INTERVENTIONAL
NCT04202510,IOP and Medication Reduction in MIGS Procedures,https://clinicaltrials.gov/study/NCT04202510,WITHDRAWN,INTERVENTIONAL
NCT00345046,A Comparison of Three Different Formulations of Prednisolone Acetate 1%,https://clinicaltrials.gov/study/NCT00345046,COMPLETED,INTERVENTIONAL
NCT05275738,The Glaucoma Nicotinamide Trial,https://clinicaltrials.gov/study/NCT05275738,RECRUITING,INTERVENTIONAL
NCT05275738,The Glaucoma Nicotinamide Trial,https://clinicaltrials.gov/study/NCT05275738,RECRUITING,INTERVENTIONAL
NCT05275738,The Glaucoma Nicotinamide Trial,https://clinicaltrials.gov/study/NCT05275738,RECRUITING,INTERVENTIONAL
NCT05275738,The Glaucoma Nicotinamide Trial,https://clinicaltrials.gov/study/NCT05275738,RECRUITING,INTERVENTIONAL
NCT05275738,The Glaucoma Nicotinamide Trial,https://clinicaltrials.gov/study/NCT05275738,RECRUITING,INTERVENTIONAL
NCT05275738,The Glaucoma Nicotinamide Trial,https://clinicaltrials.gov/study/NCT05275738,RECRUITING,INTERVENTIONAL
NCT05275738,The Glaucoma Nicotinamide Trial,https://clinicaltrials.gov/study/NCT05275738,RECRUITING,INTERVENTIONAL
NCT05275738,The Glaucoma Nicotinamide Trial,https://clinicaltrials.gov/study/NCT05275738,RECRUITING,INTERVENTIONAL
NCT05275738,The Glaucoma Nicotinamide Trial,https://clinicaltrials.gov/study/NCT05275738,RECRUITING,INTERVENTIONAL
NCT05392738,Visual Function and Patient Satisfaction in Glaucoma or Ocular Hypertensive Patients Undergoing Simultaneous Cataract Surgery and i-Stent Implantation,https://clinicaltrials.gov/study/NCT05392738,ENROLLING_BY_INVITATION,OBSERVATIONAL
NCT02279472,Optical Coherence Tomography Quantitative Analysis of Changes in Anterior Chamber After Laser Peripheral Lridotomy,https://clinicaltrials.gov/study/NCT02279472,UNKNOWN,INTERVENTIONAL
NCT02865473,Anterior Segment Imaging With Ultrahigh-resolution OCT in Patients With Glaucoma and PEX - a Pilot Study,https://clinicaltrials.gov/study/NCT02865473,RECRUITING,INTERVENTIONAL
NCT05207761,Study to Evaluate Drug-drug Interaction Safety and Tolerability in Case of the Co-administration of D565 and D930,https://clinicaltrials.gov/study/NCT05207761,COMPLETED,INTERVENTIONAL
NCT01667861,Risk Factors for Glaucoma in Musicians,https://clinicaltrials.gov/study/NCT01667861,COMPLETED,OBSERVATIONAL
NCT01206361,Real World Data Study Assessing The Persistency Of Xalacom And The Other Fixed Dose Combination Products Duotrav And Ganfort In The United Kingdom,https://clinicaltrials.gov/study/NCT01206361,COMPLETED,OBSERVATIONAL
NCT04552964,Assessment of the Impact of an add-on and Its Smartphone Application on the Daily Management of Glaucoma,https://clinicaltrials.gov/study/NCT04552964,COMPLETED,INTERVENTIONAL
NCT01068964,Safety and Efficacy of Bimatoprost Timolol Ophthalmic Solution in Patients With Open Angle Glaucoma or Ocular Hypertension,https://clinicaltrials.gov/study/NCT01068964,COMPLETED,INTERVENTIONAL
NCT02825264,STAR-LIFE Registry: STARflo Glaucoma Implant Clinical Experience Program,https://clinicaltrials.gov/study/NCT02825264,ACTIVE_NOT_RECRUITING,OBSERVATIONAL
NCT01741961,Long Term Outcome After Ahmed Glaucoma Valve,https://clinicaltrials.gov/study/NCT01741961,COMPLETED,OBSERVATIONAL
NCT00802061,Sleep at 30 Degrees in Glaucoma,https://clinicaltrials.gov/study/NCT00802061,COMPLETED,INTERVENTIONAL
NCT01306461,Tafluprost-Timolol Fixed Dose Combination Non-Inferiority Study Against Concomitant Administrations,https://clinicaltrials.gov/study/NCT01306461,COMPLETED,INTERVENTIONAL
NCT00825864,Diclofenac vs Dexamethasone in Combined Surgery,https://clinicaltrials.gov/study/NCT00825864,COMPLETED,INTERVENTIONAL
NCT04647461,Comparison of Efficacy and Ocular Surface Disease Assessment Between BRIDIN-T Eye Drops 0.15% and ALPHAGAN-P Eye Drops 0.15% in Glaucoma or Ocular Hypertensive Patients : Phase 4 Parallel Group Design Investigator-blind Active-control Randomized Multi-center Trial,https://clinicaltrials.gov/study/NCT04647461,UNKNOWN,INTERVENTIONAL
NCT00001161,Abnormalities of the Eye's Anterior Chamber Iris Cornea and Lens,https://clinicaltrials.gov/study/NCT00001161,COMPLETED,OBSERVATIONAL
NCT01157364,Safety and Efficacy of a New Ophthalmic Formulation of Bimatoprost in Patients With Open Angle Glaucoma and Ocular Hypertension,https://clinicaltrials.gov/study/NCT01157364,COMPLETED,INTERVENTIONAL
NCT05495061,A Comparative Confirmatory Study of STN1012600 in Subjects With Primary Open Angle Glaucoma or Ocular Hypertension,https://clinicaltrials.gov/study/NCT05495061,COMPLETED,INTERVENTIONAL
NCT01310764,Trabeculectomy With Subconjunctival Bevacizumab Injection,https://clinicaltrials.gov/study/NCT01310764,COMPLETED,INTERVENTIONAL
NCT00853073,Does Adding Bevacizumab Therapy in Glaucoma Surgery Improve the Success of Needle Bleb Revisions?,https://clinicaltrials.gov/study/NCT00853073,COMPLETED,INTERVENTIONAL
NCT04616573,A Post-market Study Of Use Of The OMNI® Surgical System In Open Angle Glaucoma,https://clinicaltrials.gov/study/NCT04616573,TERMINATED,INTERVENTIONAL
NCT02246764,Study of Netarsudil (AR-13324) Ophthalmic Solution in Patients With Glaucoma or Ocular Hypertension,https://clinicaltrials.gov/study/NCT02246764,COMPLETED,INTERVENTIONAL
NCT00443664,External Micropulse Diode Laser Transscleral Trabeculoplasty (EMDLT) for Severe Open Angle Glaucoma,https://clinicaltrials.gov/study/NCT00443664,UNKNOWN,INTERVENTIONAL
NCT02024464,Comparing Hydrus Microstent(TM) to the iStent for Lowering IOP in Glaucoma Patients Undergoing Cataract Surgery,https://clinicaltrials.gov/study/NCT02024464,COMPLETED,INTERVENTIONAL
NCT04722861,Development of the Glaucoma Visual Functioning Questionnaire-40 and Its Psychometric Properties,https://clinicaltrials.gov/study/NCT04722861,UNKNOWN,OBSERVATIONAL
NCT01426464,Intraocular Pressure (IOP) Lowering Efficacy of Transdermal Latanoprost Therapy,https://clinicaltrials.gov/study/NCT01426464,UNKNOWN,INTERVENTIONAL
NCT05696561,Clinical Trial to Evaluate the Safety and Effectiveness of a Canaloplasty Device in Subjects With Open-Angle Glaucoma,https://clinicaltrials.gov/study/NCT05696561,NOT_YET_RECRUITING,INTERVENTIONAL
NCT03270761,Zhongshan Iridocorneal Endothelial Syndrome Study (ICEs),https://clinicaltrials.gov/study/NCT03270761,COMPLETED,OBSERVATIONAL
NCT02138461,Tolerability of Bimatoprost 0.01% vs Latanoprost Eye Drops,https://clinicaltrials.gov/study/NCT02138461,COMPLETED,OBSERVATIONAL
NCT00971061,Ahmed Glaucoma Valve and Single-Plate Molteno Implants in Treatment of Refractory Glaucoma,https://clinicaltrials.gov/study/NCT00971061,COMPLETED,INTERVENTIONAL
NCT01092273,Bimatoprost Versus Travoprost at Cairo University,https://clinicaltrials.gov/study/NCT01092273,COMPLETED,OBSERVATIONAL
NCT01212861,Surgical Treatment of Refractory Open Angle Glaucoma,https://clinicaltrials.gov/study/NCT01212861,COMPLETED,INTERVENTIONAL
NCT01263561,Prospective Randomized Study Comparing Ex-PRESS to Trabeculectomy,https://clinicaltrials.gov/study/NCT01263561,COMPLETED,INTERVENTIONAL
NCT05289453,Phacoemulsification in Acute Congestive Glaucoma,https://clinicaltrials.gov/study/NCT05289453,RECRUITING,INTERVENTIONAL
NCT04735653,The Support Educate Empower (SEE) Program,https://clinicaltrials.gov/study/NCT04735653,RECRUITING,INTERVENTIONAL
NCT00628173,Results of Different Location of Ahmed Glaucoma Valve Implantation in Refractory Glaucoma Superior Versus Inferior,https://clinicaltrials.gov/study/NCT00628173,COMPLETED,INTERVENTIONAL
NCT01863953,A Safety and Efficacy Study of Fixed-Combination Bimatoprost and Brimonidine in Chronic Glaucoma or Ocular Hypertension,https://clinicaltrials.gov/study/NCT01863953,COMPLETED,INTERVENTIONAL
NCT01994564,Prevalence of Dyschromatopsia in Glaucoma Patients,https://clinicaltrials.gov/study/NCT01994564,WITHDRAWN,OBSERVATIONAL
NCT01028664,Use of an Ocular Telemetry Sensor in Diamox Treated Patients,https://clinicaltrials.gov/study/NCT01028664,COMPLETED,INTERVENTIONAL
NCT06152861,Travoprost Ophthalmic Topical Cream for Open-angle Glaucoma or Ocular Hypertension,https://clinicaltrials.gov/study/NCT06152861,RECRUITING,INTERVENTIONAL
NCT00811564,An Evaluation of the Fixed Combination Brimonidine Tartrate 0.2%/ Timolol Maleate 0.5% to Latanoprost 0.005% in Glaucoma or Ocular Hypertension Subjects,https://clinicaltrials.gov/study/NCT00811564,COMPLETED,INTERVENTIONAL
NCT04098861,Efficacy and Safety of Latanoprost/Timolol for Primary Open Angle Glaucoma,https://clinicaltrials.gov/study/NCT04098861,UNKNOWN,INTERVENTIONAL
NCT01714960,Safety and Tolerability of MRZ-99030 Eye Drops in Healthy Volunteers and Glaucoma Patients,https://clinicaltrials.gov/study/NCT01714960,COMPLETED,INTERVENTIONAL
NCT02796560,Generic Travoprost Versus Brand Name Travoprost in Patients With Primary Open Angle Glaucoma or Ocular Hypertension,https://clinicaltrials.gov/study/NCT02796560,COMPLETED,INTERVENTIONAL
NCT01192061,Autonomic Nervous System Activity and Normal Tension Glaucoma,https://clinicaltrials.gov/study/NCT01192061,COMPLETED,OBSERVATIONAL
NCT01192061,Autonomic Nervous System Activity and Normal Tension Glaucoma,https://clinicaltrials.gov/study/NCT01192061,COMPLETED,OBSERVATIONAL
NCT01192061,Autonomic Nervous System Activity and Normal Tension Glaucoma,https://clinicaltrials.gov/study/NCT01192061,COMPLETED,OBSERVATIONAL
NCT05080153,Effect of Vitamin Supplementation in Glaucoma Patients,https://clinicaltrials.gov/study/NCT05080153,COMPLETED,OBSERVATIONAL
NCT03284853,Safety and Efficacy Study of PG324 (Netarsudil/Latanoprost 0.02% / 0.005%) Ophthalmic Solution Compared to GANFORT® Ophthalmic Solution in Open Angle Glaucoma or Ocular Hypertension,https://clinicaltrials.gov/study/NCT03284853,COMPLETED,INTERVENTIONAL
NCT00519753,Success of Transitioning Uncontrolled Glaucoma Patients From Prior Mono or Adjunctive Therapy to DuoTrav,https://clinicaltrials.gov/study/NCT00519753,COMPLETED,INTERVENTIONAL
NCT01467453,Clinical Application of Sensimed Triggerfish Sensor (TS) With Wireless Signal Transmission for Continuous Intraocular Pressure Measurement,https://clinicaltrials.gov/study/NCT01467453,UNKNOWN,OBSERVATIONAL
NCT01814761,A Study of Bimatoprost 0.01% in the Clinical Setting,https://clinicaltrials.gov/study/NCT01814761,COMPLETED,OBSERVATIONAL
NCT05401760,Combined Phacoaspiration and Angle Surgery Versus Phacoaspiration in Pediatric Cataract,https://clinicaltrials.gov/study/NCT05401760,ENROLLING_BY_INVITATION,INTERVENTIONAL
NCT03374553,MINIject 636 in Patients With Open Angle Glaucoma Uncontrolled by Topical Hypotensive Medications,https://clinicaltrials.gov/study/NCT03374553,COMPLETED,INTERVENTIONAL
NCT03966560,Choroidal Thickness and Its Correlations With Ocular Parameters in Primary Open-angle Glaucoma,https://clinicaltrials.gov/study/NCT03966560,COMPLETED,INTERVENTIONAL
NCT04723160,Computer Aided Diagnosis of Multiple Eye Fundus Diseases From Color Fundus Photograph,https://clinicaltrials.gov/study/NCT04723160,COMPLETED,OBSERVATIONAL
NCT04723160,Computer Aided Diagnosis of Multiple Eye Fundus Diseases From Color Fundus Photograph,https://clinicaltrials.gov/study/NCT04723160,COMPLETED,OBSERVATIONAL
NCT02140060,6-Week Proof-of-Concept Study of Travoprost/Brinzolamide Ophthalmic Suspension in Subjects With Open-Angle Glaucoma or Ocular Hypertension,https://clinicaltrials.gov/study/NCT02140060,COMPLETED,INTERVENTIONAL
NCT00763061,Travatan Versus Timoptic in Treating Open-angle Glaucoma or Ocular Hypertension,https://clinicaltrials.gov/study/NCT00763061,COMPLETED,INTERVENTIONAL
NCT00159653,A 12-Week Randomized Double-Masked Parallel Group Comparison Of Evening Dosing With Xalacom In Subjects With Glaucoma,https://clinicaltrials.gov/study/NCT00159653,COMPLETED,INTERVENTIONAL
NCT06077253,Danish Angle Closure Prevention Trial,https://clinicaltrials.gov/study/NCT06077253,RECRUITING,INTERVENTIONAL
NCT04454138,Ab Interno Gelatin Stent With Mitomycin C Using Targeted Supra-tenon's Placement,https://clinicaltrials.gov/study/NCT04454138,COMPLETED,OBSERVATIONAL
NCT01059162,Evaluation of OT-135P (IOPtiMateTM) : Beam Manipulating System for CO2 Laser Assisted Non-Penetrating Glaucoma Surgery,https://clinicaltrials.gov/study/NCT01059162,UNKNOWN,INTERVENTIONAL
NCT06017362,Clinical Trial To Determine The Efficacy And Safety Of Insulin Eye Drops In Dry Eye In Patients With Topical Hypotensors,https://clinicaltrials.gov/study/NCT06017362,RECRUITING,INTERVENTIONAL
NCT04202562,Efficacy and Safety of ab Interno Trabeculectomy With the Kahook Dual Blade,https://clinicaltrials.gov/study/NCT04202562,COMPLETED,INTERVENTIONAL
NCT04437446,OCT Angiography in the Glaucoma Diagnosis,https://clinicaltrials.gov/study/NCT04437446,ACTIVE_NOT_RECRUITING,INTERVENTIONAL
NCT03752710,Biometry of Occult Lens Subluxation Misdiagnosed as Primary Acute Angle Closed Glaucoma,https://clinicaltrials.gov/study/NCT03752710,COMPLETED,OBSERVATIONAL
NCT00578110,Instrument for Glaucoma Early Detection and Monitoring,https://clinicaltrials.gov/study/NCT00578110,UNKNOWN,INTERVENTIONAL
NCT00578110,Instrument for Glaucoma Early Detection and Monitoring,https://clinicaltrials.gov/study/NCT00578110,UNKNOWN,INTERVENTIONAL
NCT00578110,Instrument for Glaucoma Early Detection and Monitoring,https://clinicaltrials.gov/study/NCT00578110,UNKNOWN,INTERVENTIONAL
NCT02051946,Novel Drug Delivery Technique Via Retroject Device,https://clinicaltrials.gov/study/NCT02051946,COMPLETED,INTERVENTIONAL
NCT02371746,Safety and Efficacy of ENV515 Travoprost Extended Release (XR) in Patients With Bilateral Ocular Hypertension or Primary Open Angle Glaucoma,https://clinicaltrials.gov/study/NCT02371746,COMPLETED,INTERVENTIONAL
NCT00545064,Dry Eye Study With Cosopt® Over 8 Weeks in Patients With Open-Angle Glaucoma or Ocular Hypertension (0507A-152)(COMPLETED),https://clinicaltrials.gov/study/NCT00545064,COMPLETED,INTERVENTIONAL
NCT00283764,Safety And Efficacy Of Xalatan Delivered Using Either A Conventional Dropper Bottle or A Delivery Device,https://clinicaltrials.gov/study/NCT00283764,WITHDRAWN,INTERVENTIONAL
NCT04274764,Screening and Intervention for Glaucoma and Eye Health Through Telemedicine,https://clinicaltrials.gov/study/NCT04274764,RECRUITING,INTERVENTIONAL
NCT04476810,Long Term Outcome of Combined Phacoemulsification and Excisional Goniotomy With the Kahook Dual Blade,https://clinicaltrials.gov/study/NCT04476810,COMPLETED,INTERVENTIONAL
NCT01194310,Phaco vs. Phaco-ELT vs. Phaco-Trabectome 12m,https://clinicaltrials.gov/study/NCT01194310,COMPLETED,OBSERVATIONAL
NCT00293761,A Study of Glaucoma Therapy to Treat Open-Angle Glaucoma or Ocular Hypertension,https://clinicaltrials.gov/study/NCT00293761,COMPLETED,INTERVENTIONAL
NCT04317573,Effect on the Adherence to Glaucoma Eye Drops by Improving Patient Understanding and Using a Tele-reminder System,https://clinicaltrials.gov/study/NCT04317573,COMPLETED,INTERVENTIONAL
NCT02565173,Study of Trabodenoson in Adults With Ocular Hypertension or Primary Open-angle Glaucoma,https://clinicaltrials.gov/study/NCT02565173,COMPLETED,INTERVENTIONAL
NCT01404364,Use of Intravitreal Triamcinolone and Retrobulbar Chlorpromazine as Alternatives to the Management of Painful Blind Eye,https://clinicaltrials.gov/study/NCT01404364,COMPLETED,INTERVENTIONAL
NCT04334564,Effect of Ginkgo Biloba Capsule on Visual Function of Primary Open-angle Glaucoma With Blood Stasis Syndrome,https://clinicaltrials.gov/study/NCT04334564,UNKNOWN,INTERVENTIONAL
NCT03323164,Peripapillary Blood Flow After Use of Anti-glaucoma Medications: An OCT Angiography Study,https://clinicaltrials.gov/study/NCT03323164,COMPLETED,INTERVENTIONAL
NCT00947661,Efficacy and Safety of SPARC0912 and Reference0912 in Open Angle Glaucoma or Ocular Hypertension,https://clinicaltrials.gov/study/NCT00947661,COMPLETED,INTERVENTIONAL
NCT01304264,Intraocular Pressure Blood Pressure Ocular Perfusion and Blood Flow Fluctuations in Glaucoma Patients,https://clinicaltrials.gov/study/NCT01304264,COMPLETED,OBSERVATIONAL
NCT01304264,Intraocular Pressure Blood Pressure Ocular Perfusion and Blood Flow Fluctuations in Glaucoma Patients,https://clinicaltrials.gov/study/NCT01304264,COMPLETED,OBSERVATIONAL
NCT04155164,Effect of Metformin on Visual Function in Patients With Glaucoma,https://clinicaltrials.gov/study/NCT04155164,RECRUITING,INTERVENTIONAL
NCT01652664,Study of Travoprost Ophthalmic Solution 0.004% Compared to Timolol (0.5% or 0.25%) in Pediatric Glaucoma Patients,https://clinicaltrials.gov/study/NCT01652664,COMPLETED,INTERVENTIONAL
NCT02114073,Comparison of Effect of Postoperative Cyclosporine A 2% Ophthalmic Emulsion and Betamethasone Eye Drop on Surgical Success of Trabeculectomy Procedure,https://clinicaltrials.gov/study/NCT02114073,COMPLETED,INTERVENTIONAL
NCT01791673,Circular Cyclocoagulation Using HIFU With EYEOP1 Device in Glaucoma Patients,https://clinicaltrials.gov/study/NCT01791673,COMPLETED,INTERVENTIONAL
NCT00815373,The Effects of Cosopt® Vs Xalacom® on Ocular Hemodynamics and Intraocular Pressure (IOP) in Primary Open-angle Glaucoma (POAG),https://clinicaltrials.gov/study/NCT00815373,WITHDRAWN,INTERVENTIONAL
NCT00470964,Titanium-Sapphire Laser Trabeculoplasty in Glaucoma: A Randomized Study Comparing Titanium-Sapphire With Argon Laser Trabeculoplasty in Open-Angle Glaucoma Patients,https://clinicaltrials.gov/study/NCT00470964,COMPLETED,INTERVENTIONAL
NCT04736264,Malay Glaucoma Eye Study II Navigation Mobility and Reading Ability in Primary Glaucoma,https://clinicaltrials.gov/study/NCT04736264,RECRUITING,INTERVENTIONAL
NCT04736264,Malay Glaucoma Eye Study II Navigation Mobility and Reading Ability in Primary Glaucoma,https://clinicaltrials.gov/study/NCT04736264,RECRUITING,INTERVENTIONAL
NCT04465864,Investigate Following Cataract Surgery With IOL in Conjunction With Intracanalicular Dexamethasone Insert,https://clinicaltrials.gov/study/NCT04465864,COMPLETED,INTERVENTIONAL
NCT01699464,A Study Assessing the Safety and Ocular Hypotensive Efficacy of AR-12286 in Patients With Elevated Intraocular Pressure for 3 Months,https://clinicaltrials.gov/study/NCT01699464,COMPLETED,INTERVENTIONAL
NCT02636946,A Comparison of Bimatoprost SR to Selective Laser Trabeculoplasty in Patients With Open-Angle Glaucoma or Ocular Hypertension,https://clinicaltrials.gov/study/NCT02636946,COMPLETED,INTERVENTIONAL
NCT01542710,Bimatoprost/Timolol Versus Travoprost/Timolol,https://clinicaltrials.gov/study/NCT01542710,COMPLETED,INTERVENTIONAL
NCT03318510,LSFG in Patients With Normal Tension Glaucoma Tension Glaucoma,https://clinicaltrials.gov/study/NCT03318510,UNKNOWN,INTERVENTIONAL
NCT01589510,A Study of Lumigan® 0.01% in Patients With Primary Open Angle Glaucoma (POAG) or Ocular Hypertension (OHT),https://clinicaltrials.gov/study/NCT01589510,COMPLETED,OBSERVATIONAL
NCT04912362,The Effectiveness of YAG Iridotomy in Preventing Peripheral Anterior Synechia After CLASS in Primary Open Angle Glaucoma,https://clinicaltrials.gov/study/NCT04912362,UNKNOWN,INTERVENTIONAL
NCT01229462,Safety and Efficacy of Brimonidine Tartrate/Timolol Fixed Combination in Patients With Glaucoma or Ocular Hypertension,https://clinicaltrials.gov/study/NCT01229462,COMPLETED,INTERVENTIONAL
NCT02981446,A Phase III Study Assessing the Safety and Efficacy of DE-117 Ophthalmic Solution Compared With Latanoprost Ophthalmic Solution in Subjects With OAG or OHT,https://clinicaltrials.gov/study/NCT02981446,COMPLETED,INTERVENTIONAL
NCT05181046,Evaluation of Nanodropper-mediated Microdrops vs. Standard Drops of 0.5% Timolol Maleate in Glaucoma Patients,https://clinicaltrials.gov/study/NCT05181046,COMPLETED,INTERVENTIONAL
NCT03891446,Long-term Safety and Efficacy Extension Trial of Bimatoprost SR,https://clinicaltrials.gov/study/NCT03891446,ENROLLING_BY_INVITATION,INTERVENTIONAL
NCT02544646,Changes in Ocular Rigidity After Trabeculectomy in Patients With POAG,https://clinicaltrials.gov/study/NCT02544646,COMPLETED,INTERVENTIONAL
NCT03808688,Study of Rhopressa® for the Reduction of Elevated Intraocular Pressure in Patients With Glaucoma or Ocular Hypertension in a Real-world Setting,https://clinicaltrials.gov/study/NCT03808688,COMPLETED,INTERVENTIONAL
